source_id,reason
9f8ce9274b3d801692c9f98f195e2ded38e528a49641a0a712c7218bf5d93bd9,domain appears compromised and serves unrelated Vietnamese betting/SEO content
c63c725ca1ce69f3de38c2d974e2a2e95f6990c150a18bc0e45ae33fdbbfa38d,obsolete Czech Radio endpoint mirrors the retained Radio Wave Zhasni podcast feed
f46713c63945dcae31cb9e655604d9b8622b71af62a1998c47dee6da5891bd17,obsolete Czech Radio endpoint mirrors the retained Radio Wave Zhasni podcast feed
232cc12a23b0f103c2d0d89a18d2d2f4031be3626488424b6ea5f3281de87bce,obsolete Czech Radio endpoint mirrors the retained Radio Wave Zhasni podcast feed
dab9929db23afe6f63718f2f87052abcb28a06c966617b5606c683bb7c0b4c06,obsolete Czech Radio endpoint mirrors the retained Radio Wave Zhasni podcast feed
acad671b248ec1706ed1c419e34fce8026f646fa3322614f2155ecf998c5c728,Mutations Cameroon domain/feed is compromised and serves unrelated Vietnamese betting content
a38670811330ad927439c7df5acabab2a0699868c1a40b6dbf2f0b2fc743ee4b,Tuvalu Paradise domain/feed is compromised and serves unrelated Vietnamese casino content
0c7429a582c86ba705df0041095cf9a6bdbe5c596d6acebc54ec4315b92df16e,feed is currently polluted by repeated casino advertorials rather than reliable Solomon Islands coverage
