Search Country,Country Code,Country Rank,Global Rank,Channel ID,Channel Name,Subscribers,Total Views,Total Videos,Country,Description
Egypt,EG,77,1653,UCtvsfbEiJmj3-54ACJH-Jxw,TONY GAMING,530000,117051951,1072,EG,معاكم محمد حمدي توني الشهير ب توني بنقدم كونتنت جيمينج سبايسي حبتين 
Egypt,EG,78,1670,UC6Pc833ujSvhaL7vYwoiwCQ,xWarCraft - وار كرافت,524000,82046175,1353,EG,هنا هتلاقي محتوي ماين كرافت المناسب للجميع مجرد سيناريوهات وضحك انا واصحابي مع بعض
Egypt,EG,79,1698,UCVIaDijeB7mlM_rwLSHU7dQ,Kanshy,511000,105079454,1894,EG,Welcome to my Channel if you like Roblox games then go Watch my Videos and Don't forget to leave a Like and Subscribe 🤩🤩 and be one of my Friends and Family here 😊 Kanshy -------------------------- منورين القناة يا ابطال لو انت بتحب روبلوكس يبقى روح اتفرج على كل الفيدوهات ومتنساش تعمل لايك للفيدوهات وتشترك فى القناة وخليك واحد من اصدقائى و عائلتى الجميله هنا🤩😊 
Egypt,EG,80,1711,UCC5MTU1ljNu3c9opp4lpEHA,LiveBoltx,502000,100626273,360,Unknown,قناه بولتكس لايف لملخصات البث المباشر 🔥  البث المباشر 🟢 : https://kick.com/3li-boltx   القناه الرئيسية 🔴 : https://www.youtube.com/@3liboltx  انستاجرام 📸 : https://www.instagram.com/3li_boltx  تيكتوك 📲 : tiktok.com/@3li_boltx 
Egypt,EG,81,1716,UC4XAMOquYBulhFF7H_1c9ng,1st Step Gaming,500000,76448682,743,EG,"قناة لمساعدة كل الجيمرز والكوليكتورز بتقديم نصائح ومراجعات عن الاجهزة والالعاب منور قناتك يا باشا   1st Step Gaming is channel dedicated to all gamers and video games collectors to last century gamer and nowadays gamer we review , play , and dig into the world of video games  support by liking and subscribing to the channel  ALL YOU CAN PLAY https://linktr.ee/karimazro "
Egypt,EG,82,1724,UCX7ES1dnlp7EB4XcKeQIVaQ,محمد البصيلي - Mohamed Elbosely,496000,243048545,154,EG,القناه الرسميه للنجم والفنان محمد البصيلي  فنان الباديه الاول للحجز والاستفسار 01099201706  ▶ Social Media : شريف غزالة و مصطفي المصري  
Egypt,EG,83,1745,UCEsngIIic7yh6_cf5BsxYXA,مجدي الزهار - Magdy ElZahar,482000,218310849,188,EG,▶ Social Media : عظيمه  ▶ Production : محمد رمضان - مينا ماهر  ▶  Manger : محمود رمضان   للاستماع علي جميع المنصات :   Official Youtube : ▶    http://bit.ly/46NKfoo Official Instgram : ▶   http://bit.ly/3IvhLqh Official Facebook:  ▶   http://bit.ly/46Oqygg Official TIK TOK : ▶    http://bit.ly/3Kbtx9Q 
Egypt,EG,84,1750,UCMIPuHhYeHc05rvDGfPzbfA,Faza3 Gaming,478000,44356632,223,EG,للدعاية والاعلان 👇🏽 business inquiries  yassermanssour322@gmail.com _______________________________________  تابعوني علي الانستا 👇🏽  https://www.instagram.com/faza3_gaming1/  _______________________________________  تابعوني علي تيك توك 👇🏽  https://www.tiktok.com/@faza3_gaming1  _______________________________________  اتمنى لك مشاهدة ممتعة ولا تنسي يا صديقي الاشتراك في القناة💙   
Egypt,EG,85,1772,UCRaZHgZDqy0pzKnZze1EcIA,RAIZER,457000,229305670,376,US,
Egypt,EG,86,1817,UCpPPSlGRsZiww-Pqjf3Ehaw,العم ميدو جيمر Al3mMedo Gamer,432000,101486407,1634,EG,💖 مرحبا بك في قناتي المتواضعه 💖  اسمي / محمد جمال 29 سنه 😃  قناتي / منوعه بشكل ما ولاكن التخصص الاكبر في السواقه والتصليح وكده فاهمني انتا 😂🔥  اهدافي -  تطوير المحتوي بقدر الامكان - ربط القناه بالواقع الحقيقي يعني كل اللي اعملو في الالعاب اكيد هيجي يوم ونعملو في الواقع ان شاء الله  وفي اهداف تانيه  ولاكن مع الايام ان شاء الله 😂🔥  المهم - خليك من الحبيايب واشترك في القناه  ❤❤❤ 
Egypt,EG,87,1846,UCkUEthM6nQe--OdWmxQS66w,OKATO GO,411000,104919795,870,EG,BE YOURSELF 
Egypt,EG,88,1866,UCEe-jmA3YnSun38ne6BUzUA,HS GAMER OFFICIAL,401000,149394783,1635,US,Welcome to my channel✅    1. GRANNY  2. MINECRAFT   3. ROBLOX   4. GTA V           
Egypt,EG,89,1882,UChGMvrGxp38s_fraGg6MdtA,Hemokok,391000,66950046,964,JO,"Gaming video creator 👨🏼‍🎓 𝗜𝗻𝗳𝗼𝗿𝗺𝗮𝘁𝗶𝗼𝗻 𝗧𝗲𝗰𝗵𝗻𝗼𝗹𝗼𝗴𝘆, Computer Science (CS) "
Egypt,EG,90,1894,UCRY5dYsbIN5TylSbd7gVnZg,Kanye West - Topic,387000,3704300963,540,Unknown,
Egypt,EG,91,1943,UC4gzsjCgbwHHvQQxz2dXgZA,Itz Gamer Tony,361000,169857650,758,IN,"          Welcome to Gamer Tony's world.                           @itzgamertony                                  🙏🙏🙏  😎 Hello gamers, I am your host Tony.  👀 On my channel you can watch beautiful computer game and mobile game videos.  ❤️ I always try to entertain my audience.  ❤️ If you like the games on my channel, be sure to subscribe to the channel.  ❤️ আমার চ্যানেলের গেমগুলো যদি আপনার ভালো লা"
Egypt,EG,92,1973,UC5ED7NjBns1dNZSjVVSNINw,LORD X,346000,125817019,1303,JO,
Egypt,EG,93,1975,UCvSyk7NcSesssJYy4sKFjOQ,احمد - ستورم اكسترا,346000,86819169,679,EG,الحمد لله والشكر لله للدعاية والاعلان : mohamedmozy1@gmail.com 
Egypt,EG,94,1998,UCwc-g1X6NyyI6xXAQlDkJqg,Chill Maar Bros,337000,17191136,73,IN,"🏵️ Welcome to our channel where mysterious adventures come to life🔥  Every day we upload unique 2D animated Minecraft Herobrine stories where Herobrine appears not as a villain, but as a mysterious helper saving players from danger.  Each short video features a different story, new style, and unexpected twist. From rescuing lost players to protecting villagers, Herobrine always appears when someon"
Egypt,EG,95,2008,UCvso1PwzTXs6-EjmOw4sRNA,حميلي انوبيس - Hemiily Anubis,334000,57955607,382,EG,اهلا بيك في مملكة انوبيس يا صديقي ❤️🔮👑
Egypt,EG,96,2053,UCawzQLFAfsEqZRBn1osTpNg,Ninjawe - BrawlStars,317000,110198224,966,TR,شخص فاضي وفاتح قناة
Egypt,EG,97,2089,UCgMyS_CuH8-N0eS62_dxyqg,جوست - MGhost,303000,138891729,2230,EG, اخوك ف الله سفير ببجي موبايل ف الشرق الأوسط  - كل يوم بث مباشر هنا وعلى التيك توك ولطلب الصوابع دوس علي أول رابط
Egypt,EG,98,2134,UCH5Pj8oU5_097UG8TPCTsxQ,ندى القلعة Nada Algalaa,288000,89231914,1997,AE,القناة الرسمية للفنانة ندي القلعة للحجز والارتباطات الفنيه هاتف :0123304304 (249+)  ملحوظة :  جميع الأغانى حصرية   تابعونا علي الصفحة الرسمية علي الفيس بوك: https://www.facebook.com/Nada.ALgal3a/
Egypt,EG,99,2142,UChqMvzmKSHHyFZ9WFu0KeUg,Ebn Othman - ابن عثمان,285000,19077033,269,EG,
Egypt,EG,100,2151,UCcH_c0deXa-gbVQsPfn2ZVA,𝗟𝗲𝘃𝗲𝗹𝗟𝗼𝗱𝘀,282000,132829024,1299,Unknown,
