Search Country,Country Code,Country Rank,Global Rank,Channel ID,Channel Name,Subscribers,Total Views,Total Videos,Country,Description
Canada,CA,1,2,UCq-Fj5jknLsUf-MWSy4_brA,T-Series,311000000,335650634349,25757,IN,"Music can change the world"". T-Series is India's largest Music Label & Movie Studio, believes in bringing world close together through its music.  For over thirty years, we’ve been more than a label. We’ve been listeners archeologists of emotion, digging in every corner of India, collecting stories and music in all forms told in all Indian languages.   And we believe that the language of the heart"
Canada,CA,2,10,UCLkAepWjdylmXSltofFvsYQ,BANGTANTV,83300000,27176655244,2984,Unknown,This is the official YouTube channel of BTS. 방탄소년단 공식 유튜브 채널 입니다.
Canada,CA,3,28,UCSf0s2ogUVYpJPuzW1zpAOg,LankyBox,42000000,39162043585,10211,US,"LankyBox includes Foxy, Boxy, Ghosty, Rocky, Thicc Shark & MORE! You will see crazy gaming videos, insane animations, and lots more! "
Canada,CA,4,33,UCTkXRDQl0luXxVQrRQvWS6w,Dream,34100000,4234149855,287,US,"I am DREAM. I like playing games, streaming, coding, and making videos with my FRIENDS!"
Canada,CA,5,34,UCEf_Bc-KVd7onSeifS3py9g,SMTOWN,33600000,33285907184,4677,Unknown,Welcome to SM Entertainment Official YouTube Channel! You can enjoy SM artist's latest videos on SMTOWN Official YouTube Channel.
Canada,CA,6,42,UCKqH_9mk1waLgBiL2vT5b9g,VanossGaming,26000000,16859074352,2221,US,Official Vanoss Gaming YouTube Channel.
Canada,CA,7,44,UCke6I9N4KfC968-yRcd5YRg,SSundee,25300000,17005552696,3693,US,Welcome to my channel!  I upload a lot of funny Minecraft and Roblox Videos! I also upload random games. lol I yell a lot.  I also play random games from time to time.  -SSundee
Canada,CA,8,60,UCLbdVvreihwZRL6kwuEUYsA,Think Music India,22200000,21843228813,6914,IN,About Think Music - Official Channel  The official YouTube channel of Think Music.   
Canada,CA,9,63,UCn4rEMqKtwBQ6-oEwbd4PcA,Sony Music South,21300000,20729278314,5420,IN,"Sony Music South – Official Channel 🎶 Welcome to the official YouTube home of Sony Music Entertainment India, your one-stop destination for the latest and greatest music videos in Tamil, Telugu, and Kannada! From heartwarming love songs to electrifying kuthu beats, we bring you the most popular hits, new releases, and evergreen favorites from South India’s vibrant music scene. Whether you're vibin"
Canada,CA,10,68,UCKy1dAqELo0zrOtPkf0eTMw,IGN,19800000,21190494351,179232,US,"IGN brings you daily videos about the latest gaming and entertainment news and up to the minute events coverage.  Subscribe to IGN’s YouTube channel for video games, tech, TV, movie news, reviews, exclusive previews, and home-brewed shows like Devs React to Speedruns and IGN Inside Stories.  Daily Fix - Gaming and entertainment news every Monday through Friday. IGN First - Exclusive coverage of up"
Canada,CA,11,89,UCxsk7hqE_CwZWGEJEkGanbA,KreekCraft,16700000,7088178326,6838,US,SUBSCRIBE IF YOU PLAY ROBLOX!
Canada,CA,12,93,UCi8e0iOVk1fEOogdfu4YgfA,Rotten Tomatoes Trailers,16100000,13896114211,13100,US,"Rotten Tomatoes TRAILERS delivers hot new trailers, exclusive content, and first looks for all the best upcoming movies. Subscribe to be the first to see everything coming to theaters and your favorite streaming platforms - all in one place!   We invite you to join the conversation on YouTube or leave a review on RottenTomatoes.com, but please read our Community Guidelines so that the discussion c"
Canada,CA,13,97,UC5H_KXkPbEsGs0tFt8R35mA,Martin Garrix,15200000,7275834837,514,US,"Multi-platinum-selling, chart-topping Dutch DJ and producer Martin Garrix is one of the most successful artists to break into the pop and electronic music scenes. Since his breakout hit ""Animals"" in 2013 at just 17 years old, Garrix has headlined festivals globally and collaborated with top stars including Dua Lipa, Bono, The Edge, Macklemore, and Khalid. Known for his high-energy performances and"
Canada,CA,14,103,UCm-X6o81nRsXQTmqpyArkBQ,Flamingo,14400000,12436657326,2790,US,The Most Botted Channel EVER 
Canada,CA,15,120,UCs6eXM7s8Vl5WcECcRHc2qQ,Kanye West,12300000,9514227695,41,US,BULLY BY YE OUT NOW STREAM HERE: https://yzy.lnk.to/BULLY  
Canada,CA,16,129,UC_F8DoJf9MZogEOU51TpTbQ,Clash Royale,11700000,2694248553,870,Unknown,"Clash Royale is a real-time, head-to-head battle game set in the Clash Universe. Welcome to the Arena!"
Canada,CA,17,142,UC0eLBYhxW9HC0P9PXQ73mpQ,Cash,10700000,3250630772,1406,US,I love to play Minecraft with my friend Nico! 
Canada,CA,18,145,UC_q5WZtFp36adwqhKpZzxwQ,SypherPK,10600000,7064813524,3482,US,Hey everyone! I’m Sypher and I make gaming videos :)  Socials:  - Watch me live at: http://www.twitch.tv/sypherpk   - Twitter: http://www.twitter.com/sypherpk   - Instagram: https://www.instagram.com/sypherpk  - Facebook: https://facebook.com/SypherPK  - Discord: https://discord.gg/SypherPK -----------------------------------------------------------  Want to be part of my YouTube editing team? App
Canada,CA,19,146,UCRkuUgtDAL4XSU5jB40J_wA,Foltyn,10400000,3439808366,1808,Unknown,I just wanna make people smile   
Canada,CA,20,150,UC63anZxfVGHUEmfBAf5w7pw,CaseOh,10000000,2094381381,2252,US,Streamer on Twitch - caseoh_  
Canada,CA,21,158,UCsPMNatXCwqyUuJilBT73jg,CaylusBlox,9700000,3015217329,840,US,i play roblox here subscribe and join the CAYLUS KINGDOM 
Canada,CA,22,166,UCDBCCMlFD-hArPbWv38FINA,Daz Games,9440000,3246199844,1728,GB,"Welcome to the official channel of Daz Games! Here you’ll find all my Try Not To Laugh Challenge, Sketch and Reaction videos where you’ll enjoy my responses to videos from Jacob Sartorius, Musical.ly and everything else on the internet you hold so dearly. I like to do commentary walkthroughs and playthroughs of games like Sims, Uncharted 4, GTA V, Minecraft and many other games. New gaming videos "
Canada,CA,23,172,UCvICJHzZEwb_9ckAMohAqzw,Lana's Life,8930000,9215212350,3346,US,"💗 If You LOVE ROBLOX Content, Make Sure To Subscribe!  💗YT Shorts Posted Daily & Long Form Videos Posted Weekly!"
Canada,CA,24,178,UCNvzD7Z-g64bPXxGzaQaa4g,gameranx,8570000,4400317754,4662,US,"We make videos about video games. Enjoy our Top 10s, the Friday news show, Before You Buy reviews and first impressions, and more."
Canada,CA,25,179,UCzEy7pi3B7TIS9cn_sdKK9A,GrayStillPlays,8530000,5161736974,4291,US,I make bad choices in games and cause pixel people to become sad.  All brand and sponsorship opportunities: graystillplays@gmail.com Manager Paragon Hex: paragonhex.business@gmail.com --------------------------------------------------------------------------------------------------------------- Channel art by: http://themoski.tumblr.com/ TJFX22
Canada,CA,26,181,UCzXwjTI6c6mVn6oui_p6oiw,SMii7Y,8490000,3496413366,1386,CA,"Pronounced ""Smitty"" -  Gameplay, Funny Moments, Hilarity & More!  Use code S7 on Gamer Supps for 10% OFF your order! https://gamersupps.gg/s7 "
Canada,CA,27,182,UC6pGDc4bFGD1_36IKv3FnYg,Crunchyroll,8490000,10513564195,387838,US,"Crunchyroll brings you clips, anime openings, anime endings, trailers, teasers, and full episodes every week from the best titles anime has to offer!  "
Canada,CA,28,184,UCJ2ZDzMRgSrxmwphstrm8Ww,Smosh Games,8460000,3950478848,4206,US,"Video games, board games and more! New videos every Wednesday, Friday, and Sunday."
Canada,CA,29,201,UC-kOXc3gBwksVfmndSEz7jg,WILDCAT,8020000,3272161727,2747,US,"Tyler - I AM WILDCAT  For Business Inquiries Contact: business@iamwildcat.net  About Me: My name is Tyler and I make my videos for fun and to get a couple laughs out of my viewers. I do my best to make entertaining content and upload as often as I see fit. Feel free to subscribe, it's free :D"
Canada,CA,30,204,UChO8h2G8UjOVc081rgYU8XQ,Vibe Music,7870000,7650535795,2210,NL,"Vibe Music strives to bring the best lyric videos of popular Rap & Hip Hop songs.  Be sure to Subscribe to see new videos we upload!  If any producer, artist or label has an issue with music upload, please contact me and I will remove the material immediately.  Business Inquiries: droppinglyricsvibe@gmail.com"
Canada,CA,31,214,UCdtXPiqI2cLorKaPrfpKc4g,Entertainment Tonight,7610000,8898370438,54957,US,"Entertainment begins and ends with ET.  ET is the Leading source of all things entertainment: Our mission is to use our unprecedented access to pop culture’s biggest stars, movies, and tv shows to deliver entertainment and celebrity news with the authority you expect everywhere you are. https://www.youtube.com/watch?v=eQCtD8FUMq4"
Canada,CA,32,222,UCQHX6ViZmPsWiYSFAyS0a3Q,GothamChess,7300000,4792787804,3078,US,The Internet's Chess Teacher
Canada,CA,33,230,UCiFyJ_EBmF2XJuR9buWE_3A,Unchained_Off,7040000,3833904091,1729,FR,CLICK ICI : MA CHAINE IRL 👇
Canada,CA,34,239,UCV_CsAy5CNBX_uwDQ7RMe1Q,Central Cee,6700000,2440189843,92,GB,Central Cee - Official youtube channel. Subscribe
Canada,CA,35,246,UCZBY6V8Lxmwu8gGRBOyO11w,Kubz Scouts,6520000,3531290784,3133,Unknown,My name is Jay and I just want to have fun being dumb  Banner created by @NeroArts
Canada,CA,36,261,UC7c8wbA9yQjzxkj2uyrHrkg,steak,6240000,2132806169,2807,US,"live everyday 4pm & 9:30 EST 😜  i just like having fun dont take me seriously pls   SEND ME STUFF:  P.O BOX 171002 Salt Lake City, UT, 84117 "
Canada,CA,37,262,UCjiXtODGCCulmhwypZAWSag,Jynxzi,6230000,2229765369,1990,Unknown,Business email: jynxzi@rightclick.gg
Canada,CA,38,274,UCjuV-yJ3ceiHI4ixglXxksA,Crown Records,5840000,2397059229,426,US," Now Owned and Operated by Hub Entertainment Welcome to Crown Records 💿- The one stop destination for your musical experience .   With the most versatile catalogue of songs we stand 5.7M strong with you all .  Crown Records is committed to bringing you only the best.  Join us, subscribe, and experience the true power of Punjabi beats.   Keep supporting and we will keep delivering 🔊✌️  🎶Visit our o"
Canada,CA,39,283,UCzzF1kdBgwv5RB6rbB6kVSA,Tyler & Snowi,5690000,3350319465,1248,US,Daily videos with Tyler & Snowi! Subscribe so you don't miss out! 😄 
Canada,CA,40,290,UCjB_adDAIxOL8GA4Y4OCt8g,MM7Games,5630000,3384512364,6236,Unknown,2nd Channel for any games you want me to play!!
Canada,CA,41,301,UC7trU46U_9XPDtMnDbiDPUQ,JEV,5480000,2575838096,3914,US,HEADPHONE USERS BEWARE!   
Canada,CA,42,303,UC9CuvdOVfMPvKCiwdGKL3cQ,GameGrumps,5450000,7318290695,9747,US,"Game Grumps: Dan and Arin playin' games, gettin' mad and being bad!  Game Grumps uploads every day at 10AM PST!  Here's the NEWEST Upload Schedule (times are Pacific): Game Grumps Compilations air every other Friday 10 Minute Power Hour airs weekly on Monday's over on our live action channel, @The Grumps at 9AM PST  Send us stuff! Our NEW P.O. Box: Game Grumps PO Box 1838 Glendale, CA, 91209  CHAT"
Canada,CA,43,313,UCzcRQ3vRNr6fJ1A9rqFn7QA,ONE Media,5120000,5660041544,8113,US,"Boxoffice : your #1 destination for full movies, movie clips and trailers  The Boxoffice Company is a global media operation dedicated to generating awareness and excitement for theatrical, home-ent., and streaming titles.  We operate a global network of media brands, each market leader in their respective country. We also manage the largest multi-channel YouTube network in the world fully dedicat"
Canada,CA,44,315,UCiifkYAs_bq1pt_zbNAzYGg,DC,5100000,2264543674,4069,US,"Welcome to DC, the official home of Superman, Batman, Wonder Woman, Green Lantern, The Flash and the rest of The World's Greatest Super Heroes! "
Canada,CA,45,340,UC2uQvUg3YYzoOtj1yZLT0Ow,FoltynPlays,4820000,868517153,1113,Unknown,I Like To Make People Smile :)  For Business Inquires: foltyn@ellify.com 
Canada,CA,46,352,UCDiFRMQWpcp8_KD4vwIVicw,Emergency Awesome,4740000,2886799716,6804,US,"All the best House Of The Dragon Game Of Thrones, The Mandalorian, Batman, Avengers and Marvel Movies, The Boys, The Flash, Trailer, Promo, Easter Eggs, and Comics, Sci Fi and Fantasy Stuff with me, Emergency Awesome Charlie Schneider including:   Game of Thrones Prequel House of The Dragon, Knight Of The Seven Kingdoms, Star Wars The Mandalorian & Grogu, Avengers Doomsday and Future Marvel Movies"
Canada,CA,47,357,UCNDzLI-hyihpAx3zKtwhGZw,Techy Plays,4670000,733079685,1247,Unknown,I love to make people smile :)  business: techysbusiness@gmail.com 
Canada,CA,48,370,UCQeRaTukNYft1_6AZPACnog,Asmongold TV  ,4480000,5110759399,6917,US,"The official Asmongold channel for all of his stream content (Highlights, Competitions, Reactions & More). Asmongold TV is owned by Asmongold and run by Daily Dose of Asmongold and CatDany, with the main goal of bringing you the best moments from the stream."
Canada,CA,49,378,UCRHXUZ0BxbkU2MYZgsuFgkQ,The Spiffing Brit,4410000,1067947871,763,GB,Hey all welcome to the channel  HAVE A BUSINESS ENQUIRY? Email Here: thespiffingbusiness@gmail.com  Content is mostly strategy games or classical games with many exploits Name: Tom *Will accept being called Brit or spiffing Location: UK Occupation: Drinking Tea  Content Shown on the channel is created thanks to the full Spiffing Brit Team:  M4NG0 - Editor Manager/ Video Review Connorbrow - Communi
Canada,CA,50,382,UCcJL2ld6kxy_nuV1u7PVQ0g,DrDisRespect,4390000,874937260,1848,US,The Official Dr Disrespect YouTube Channel
Canada,CA,51,403,UCY0R0Ck6qK2deVTKkfWJIEA,CashBlox,4160000,1593480105,1115,US,Cash's Roblox Channel 
Canada,CA,52,404,UChU3JRloULzdFX3aCu7BiSA,DreamXD,4160000,360031951,130,US,"My main channel is @Dream, I post lots of alternate stuff here."
Canada,CA,53,440,UCpFFItkfZz1qz5PpHpqzYBw,Nexpo,3820000,415850515,134,US,Exploring the Internet's dark side.  Topic submissions: submit@nexpo.tv Business & sponsorship inquiries: partnerships+nexpo@manatalentgroup.com 
Canada,CA,54,452,UC3S6nIDGJ5OtpC-mbvFA8Ew,Orange Juice Gaming,3640000,2287988541,4013,CA,"Hello I'm OJ  I do mobile games like Clash Royale, Brawl Stars, Clash of Clans and other Supercell games."
Canada,CA,55,457,UC85aYbNSFjsJdxfpxgQr8tA,Judo Sloth Gaming,3600000,921882505,2047,GB,"A Clash of Clans based channel focusing on helping you improve your gameplay. You will see a variety of content from guides, to update sneak peeks and let's play videos. If you are a Clasher then Judo Sloth can help you with educational videos that are kept fun and entertaining. You will be able to stay up to date with all of the latest Clash of Clans Update News so be sure to subscribe. Have a go"
Canada,CA,56,470,UCiVJZlfcmWMUiXv5oywnDhQ,Wifies,3440000,313488621,541,US,I think it's pronounced wee-fees but I really have no idea  
Canada,CA,57,477,UCSEQjmaQ-N3lcPzyvBcFWfg,Troydan,3400000,1264747806,1805,CA,I play video games
Canada,CA,58,502,UCsgv2QHkT2ljEixyulzOnUQ,AngryJoeShow,3250000,1766375286,4165,Unknown,"AngryJoeShow - Just one Guys Opinion on Games, Movies & Geek Stuff.  Spread the word &share my channel with your friends!  I work hard to release 2-3 vids a week! How's about a $1 donation to keep my supply of G-FUEL going! =)  Donate button at my site! It helps me go crazy & bigger on the next review!  My ""GO! to the Website"" Theme Song is done by Callenish Circle ""Suffer my Disbelief"""
Canada,CA,59,515,UCweCc7bSMX5J4jEH7HFImng,GMHikaru,3130000,1226569392,5173,US,As #2 in the world of chess it's my pleasure to host this channel to share my knowledge and love of chess.  Check out the live streams on kick and twitch to see full content.  VODs of kick and twitch are posted on https://www.youtube.com/@moregmhikaru
Canada,CA,60,538,UCntCTaM2Jz1sLN3iRwabpMA,Elanip,3020000,1179792170,7935,GB,I like video Games.
Canada,CA,61,565,UCCWSG8MXoqvIEBPRnOSxwzw,Scump,2850000,832849122,3517,US,"Seth “Scump” Abner is considered one of the greatest professional Call of Duty players in history. After 14 successful years, he retired in early 2023. During his professional career, he amassed 30 major tournament wins, back-to-back X Games Gold medals in 2014 & 2015, Esports Console Player of the Year in 2016, World Champion in 2017, and World Series of Warzone Champion in 2021. He was also list"
Canada,CA,62,570,UC5HEq5U--O5nn134mizyCcw,Swedish House Mafia,2830000,2442027985,237,Unknown,"Formed in 2008, Swedish House Mafia—Axwell, Steve Angello, and Sebastian Ingrosso—quickly became global icons in electronic music. They brought house to arenas, sold out Madison Square Garden, and closed Coachella’s main stage. Their hits “Save the World” and “Don’t You Worry Child” earned GRAMMY® nominations and multi-platinum status. After a record-breaking farewell tour and five-year hiatus, th"
Canada,CA,63,576,UCeP4Yv3s4RvS0-6d9OInRMw,Real Civil Engineer,2790000,1088161981,1926,GB,I am a child stuck in an Engineer's body...  Want to send me stuff? Use this address: Real Civil Engineer Suite 16 45 Salisbury Road Cathays Cardiff CF24 4AB United Kingdom 
Canada,CA,64,585,UCudlnfkmb1LgK4tSgctPNOQ,DangerouslyFunny,2750000,1390592567,2646,CA,  Business inquiries to the email address below. This is my business managers email and not my personal email. Not at all interested in your Network.
Canada,CA,65,589,UCwV_0HmQkRrTcrReaMxPeDw,loltyler1,2740000,671065128,1925,US,
Canada,CA,66,596,UC-xlbELlElmSuioJ3hK7EqA,Alaska Violet,2690000,691925949,754,Unknown,⭐️use star code: ALASKA⭐️  For BUSINESS enquires email: alaskaviolet@fixated.com  Roblox: Alaskaviolett Tiktok: Alaskaviolett Instagram: Alaskaviolett Roblox Group: ALASKIANS 
Canada,CA,67,604,UCpJmCkjsJbqIBdvTRx2zt-w,Sony Music Malayalam,2650000,4714417551,11321,IN,"🎶 Sony Music Malayalam 🎶 Welcome to the ultimate destination for the best of the best Malayalam songs — timeless classics, soul-stirring melodies, and chart-topping hits that have defined generations. From golden oldies to contemporary masterpieces, our channel is a celebration of Kerala’s rich musical heritage. ✨ Whether you're a die-hard fan of legendary composers or a new listener discovering t"
Canada,CA,68,605,UCFKDEp9si4RmHFWJW1vYsMA,EthosLab,2640000,954604631,2572,CA,"Minecraft let's plays and other Minecraft videos. Hello, and welcome to my channel. I forget to edit this to say something even more original.  Special Thanks To: LtheHedgehog: Video Intros Raid3r: Video Intro TiggyLi: Channel Banner DavyBhoyProductions: Channel Icon  Video Recording & Editing: Video/Audio is captured using OBS Studio and edited using DaVinci Resolve v19.  Recording Mic: AT2035 XL"
Canada,CA,69,606,UCd9TUql8V7J-Xy1RNgA7MlQ,zanny,2640000,809548072,688,PH,subscribe and join the zan clan
Canada,CA,70,631,UC8whlOg70m2Yr3qSMjUhh0g,Kep1er,2520000,1141820463,1590,KR,This is the Official YouTube channel for Kep1er  
Canada,CA,71,637,UCs3GloeEzu5rDlQlSLGrr4A,Sparkles,2500000,707735553,2309,GB,"Edd ""Sparkles"" Stanton. Founder of SkinSearch.com & Sparkles Production. Entertaining gamers since 2013.  ★★★★★  "
Canada,CA,72,662,UCr1kbyiJzl-x5YYDxhYJuPw,MoreCaseOh,2370000,534532488,1912,Unknown,Thanks for checking out my 2nd channel.    
Canada,CA,73,664,UC-KM4Su6AEkUNea4TnYbBBg,PlayStationGrenade,2350000,630180952,995,GB,PlayStationGrenade is here. Come join our dysfunctional family. 
Canada,CA,74,712,UCVhGR9TU1vfvHXl73uaEiEQ,Nizarisaqt,2150000,2817647158,1795,US,In God We Trust Business Inquiry: Oumnia392814@gmail.com 
Canada,CA,75,759,UCkg2ZDee9ZLBCd2LVB6DPHA,AR12Gaming,1970000,1139937046,5084,CA,Business Email: sales@ar12gaming.com 
Canada,CA,76,789,UCOgaIuQYGr6ow_jbote4BKA,Maximilian Dood,1870000,1534773973,8650,US,"The biggest fighting game channel on Youtube, created and produced by Maximilian. Commentaries, reviews, short films and multiple fighting game coverage. Also videos for several other games including news updates for titles I'm generally excited for. ULTIMATE GOAL- Makes fighting games fun and understandable for everyone. Thanks for stopping by!  For business inquiries or channel relations, contac"
Canada,CA,77,814,UCzCzMjtMD4vCWVgbmv4uq0Q,Kevko,1800000,662591094,2072,FR,🌟 Youtubeur Pigeon 🌟  🎥 Une vidéo tous les jours  🎥  ⬇️ Mes réseaux ⬇️  📽 Youtube : Kevko  🎥 Chaîne IRL : Kevko Life  🎥 Chaîne réaction : Kevko React  📸 Instagram : Kevko YT  🟡 Snapchat : Kevko_youtube  ⚫ Tiktok : kevko_yt  📨 Contact Pro : partenariats@kevko.fr
Canada,CA,78,823,UCMNEVbszv8ZyvSXoTn3yhpQ,TheBurntPeanut,1760000,396578998,1086,Unknown,Live On Twitch/Youtube/Kick/X 7:00PM-2AM CST Mon-Sat theburntpeanut@loaded.gg
Canada,CA,79,826,UCeBPTBz1oRnsWsUBnKNNKNw,Joe Bart Games,1740000,431266888,570,US,I post gaming stuff Twitch: Joe_Bartolozzi Insta: joe.bartolozzi Tik Tok: joe.bartolozzi 
Canada,CA,80,838,UCqJ-Xo29CKyLTjn6z2XwYAw,Game Maker's Toolkit,1710000,213730485,231,GB,"Game Maker's Toolkit is a deep dive into game design, level design, and game production, hosted by Mark Brown.  Want to contact Mark? Visit the GMTK website below to find the contact form. "
Canada,CA,81,851,UCpHCfDBZ3AJyuofz6DHy-ew,Dash,1670000,943286357,1456,Unknown,charismatic Minecraft YouTuber
Canada,CA,82,856,UC-8zLYB2DB1fFCP3KJxe0Sg,MiniBloxia,1650000,484552447,1293,US,Roblox is the cure to all boredom...
Canada,CA,83,870,UCHsx4Hqa-1ORjQTh9TYDhww,Takanashi Kiara Ch. hololive-EN,1620000,315735509,1622,JP,Virtual Idol Phoenix on the rise🐦‍🔥 Based in Austria & Japan🌎Join KFP now!👇  For Inquiries Cover Corp: http://cover-corp.com/ Official Twitter: https://twitter.com/hololive_En
Canada,CA,84,891,UCKQ5Jj35sjTmJigRtlCPhVQ,ComicVerse,1560000,540875322,1410,IN,"A Superhero, Pop culture nerd. Mister Doctor.. It's Strange.. "
Canada,CA,85,897,UCmG2EhfOwSjpPMX4LjGY__A,KairosTime Gaming,1540000,607989326,1468,US,"I'm KairosTime, and it's TIME to BRAWL! I Freaking LOVE Brawl Stars and I want to share my love for the game with YOU! Come join the fun and check out my content!   Brawl Stars is an EXTREMELY entertaining game! It requires fast reflexes, solid strategy, and a love for fun! If you have these things, you're definitely going to want to play Brawl Stars!   If you're ready to Brawl, the Time is now!  "
Canada,CA,86,906,UCUmC7gXciukRv73CQRQ5QGQ,BMTHOfficialVEVO,1530000,2097231064,116,Unknown,"Bring Me The Horizon on Vevo - Official Music Videos, Live Performances, Interviews and more..."
Canada,CA,87,923,UCu9sYmfPNydPJFqLLTdmxvA,KOT4Q,1470000,634393316,2164,US,
Canada,CA,88,929,UCO1ITICo8MLHGAXR1uzFwjA,OneyPlays,1460000,1221935996,4097,US,This is my Gaming/ALT where I'll upload Gaming videos and whatever I wan't and you're not allowed to complain at me about it hehehe.
Canada,CA,89,940,UCDa8HbNrmkFhKKOeiB7JaRw,Teo,1430000,653401268,2015,SE,I do funny gaming videos of all sorts of games! Enjoy your stay! business: teo@mythictalent.com
Canada,CA,90,947,UCTMqfzLAOMqVUEyj9qW1vCw,Memeio,1410000,268571455,498,AU,Your favourite nasally Rust player.  Subscribe today.  
Canada,CA,91,948,UC3wXNek0WLlrsirz2oz-UEQ,Knarfy,1410000,206588965,372,US,"Wholesome Chaos created by a Teddy Bear!  Breaking, Coding, and Analyzing Minecraft with your Dumb Ideas.  📄 Business Inquiries Only: business@knarfy.com  🎙️ Discord Server: https://discord.knarfy.com  👕 Check out the Merch Store!! ► https://store.knarfy.com/  Want even more Knarfy Content? ► Check out https://www.youtube.com/@KnarfyToo (Maps, Edits of Streams, and literally just more of what happ"
Canada,CA,92,957,UC2nMSE3t71qC8sG06WSJnMg,RageGamingVideos,1390000,905310682,11903,Unknown,"We're a channel with a focus on Monster Hunter and all things RPG, from genre to theme, we're all about grand adventures and awesome moments though we don't shy away from checking out any game and having our signature brand of fun with it, we're Josh, Cotton and Hollow and if you stick around we'll be sure to give you something to enjoy!  Come join RageGaming and be awesome!  If you have a busines"
Canada,CA,93,961,UCAua9maY1vtNdBlYqnHRhwA,LixianTV,1390000,64888132,126,Unknown,
Canada,CA,94,973,UC3tNpTOHsTnkmbwztCs30sA,Northernlion,1370000,1763291761,22180,Unknown,"Subscribe for new videos of AAA and indie games every single day!  If you have an interview request, a business inquiry, or you're a developer who wants to have your game featured on the channel, shoot me an e-mail.  E-mail: northernlionbusiness[at]gmail.com   If you are a viewer who has a question, please don't e-mail me! Ask me on Twitter instead."
Canada,CA,95,975,UCorikuuyFz1dZLo3N9nHc4w,Blarg,1360000,450605952,896,CA,"Matt(Blarg)   I upload gaming content :) New video every Tuesday, Friday, and Sunday!  Second Channel: https://www.youtube.com/channel/UC2CvQ4VjHq8bVWj3uOSehJQ"
Canada,CA,96,981,UCz1GPotHecuLngiLuY739QQ,Rotten Tomatoes TV,1350000,1047726523,13426,Unknown,"Welcome to Rotten Tomatoes TV! We bring you the hottest trailers from the most talked-about scripted cable, network, and streaming shows as well as the best scenes from your favorite series. Subscribe to stay in the know on what's premiering, what's binge-worthy, and what's Fresh or Rotten.    We invite you to join the conversation on YouTube or leave a review on RottenTomatoes.com, but please rea"
Canada,CA,97,982,UCz6XquIbM5OcfK7r3hQQCXA,Ludwin,1350000,1233627688,1664,Unknown,Official highlights channel for Ludwig Ahgren.
Canada,CA,98,1013,UC7-hR5EfgpM6oHfiGDkxfMA,Tolarian Community College,1280000,601352711,2051,US,"Tolarian Community College is the #1 Magic: The Gathering channel featuring product reviews and unboxing videos, gameplay tips, tricks and strategy, lore, online analysis, and how to play this amazing card game.  Tolarian Community College PO Box 13607 Portland, OR 97213"
Canada,CA,99,1031,UCkYN96I4bvKx2fIF8KXjs3w,iProMx,1250000,312689022,1624,FR,GTA 5 Avec iProMx c'est le FUN =D !  E-mail Pro : ipromxyoutube@outlook.fr
Canada,CA,100,1040,UCrDFC0z7qUlI1KQZ26eL2xw,Faide,1230000,279536031,735,US,Beat the odds 
