Search Country,Country Code,Country Rank,Global Rank,Channel ID,Channel Name,Subscribers,Total Views,Total Videos,Country,Description
Egypt,EG,1,10,UCLkAepWjdylmXSltofFvsYQ,BANGTANTV,83300000,27176655244,2984,Unknown,This is the official YouTube channel of BTS. 방탄소년단 공식 유튜브 채널 입니다.
Egypt,EG,2,21,UCIPPMRA040LQr5QPyJEbmXA,MrBeast Gaming,55200000,10521931307,170,US,New MrBeast or MrBeast Gaming video every single Saturday at noon eastern time!  MrBeast Gaming - SUBSCRIBE OR ELSE
Egypt,EG,3,33,UCTkXRDQl0luXxVQrRQvWS6w,Dream,34100000,4234149855,287,US,"I am DREAM. I like playing games, streaming, coding, and making videos with my FRIENDS!"
Egypt,EG,4,43,UCV2JkEBmtfSYGAIlprAhAyQ,شبكة العاب العرب | Arab Games Network,25500000,11031114792,7985,SA,"اسمي سيد صاحب قناة العاب ترفيهية .  أنجازاتنا :  - أكبر قناة في البحرين ( 2018,2019,2020,2021,2022,2023,2024 ) - أكبر قناة العاب في البحرين ( 2018,2019,2020,2021,2022,2023,2024 ) - أكبر قناة العاب في الشرق الاوسط ( 2019,2020,2021,2023,2024 ) - أول قناة العاب عربية تحصل على الدرع الماسي "" 10 مليون "" ( 2020 ) - أول قناة في البحرين تحصل على الدرع الماسي "" 10 مليون "" (2020 ) - أفضل قناة العاب عربية ( "
Egypt,EG,5,92,UCjf3ZSi7xMu8O9frZZ8FEGg,أترو/Atro,16100000,3263520145,2748,IQ,أترو/Atro
Egypt,EG,6,94,UC6P6SvP2arhEdJ9Pg8qwP2A,Athos,15900000,9501469972,3793,BR,🔴 VÍDEOS NOVOS TODOS DIAS 10:30 DA MANHÃ 🔴  Acesse nossa Loja Oficial: lojadoathos.com  📧 Email comercial: ads@playathos.com 
Egypt,EG,7,116,UC3CFqU4KlktVPPJ1Km87pRg,مصطفى GAME OVER,12700000,4571032675,1267,AE,شاب بسيط العب ماين كرافت وانزلها على اليوتيوب للدعاية والاعلان .. For Business Inquiries business.mgameover@gmail.com   
Egypt,EG,8,129,UC_F8DoJf9MZogEOU51TpTbQ,Clash Royale,11700000,2694248553,870,Unknown,"Clash Royale is a real-time, head-to-head battle game set in the Clash Universe. Welcome to the Arena!"
Egypt,EG,9,146,UCRkuUgtDAL4XSU5jB40J_wA,Foltyn,10400000,3439808366,1808,Unknown,I just wanna make people smile   
Egypt,EG,10,148,UCHVDgaiLbpj5Leazw8vsAmg,صالح - oPiiLz,10100000,3016910361,1798,SA,محتوى هبد  حسابات التواصل الإجتماعي:  Snpachat : oPiiLz Twitter: ioPiiLz Instagram: oPiiLz TikTok: oPiiLz kick.com/opiilz  ♥♥♥   للإعلان في القناة ads:  oPiiLz.Falcons@gmail.com  
Egypt,EG,11,152,UChvFYu5FDtRWDvKcb1hUvZw,Mkamel GG,9910000,2450416846,2411,EG,Ok Ok 👌   للتواصل والاعلانات : mkamelbusiness1@gmail.com   اسمي محمود كامل من مصر منشي محتوي ألعاب فديو 😁  قناتي او مراتي الاول Mkamel ❤️😂  باذن الله بيكم هنوصل ❤️   دسكورد : Mkamel#8106
Egypt,EG,12,158,UCsPMNatXCwqyUuJilBT73jg,CaylusBlox,9700000,3015217329,840,US,i play roblox here subscribe and join the CAYLUS KINGDOM 
Egypt,EG,13,175,UChruvnbwqZ1J1-skg4R5bVQ,حسن شاكوش - Hassan Shakosh,8700000,2834695150,214,EG,القناه الرسميه لـ الهضبه حسن شاكوش   Social Media ◀ شريف غزالة - مصطفى المصرى  ------------------------------------------------ Official Youtube  :▶  http://bit.ly/2LXpOfc Official Instgram :▶  http://bit.ly/35qvJAP Official Facebook :▶  http://bit.ly/2YVXFdx
Egypt,EG,14,210,UC8z_uxBRoIjSeVRIeVaE9hQ,EstubeGaming,7710000,4561486200,4913,SA,"اهلا وسهلا بيكم فى قناتى المتواضعه بحب انزل فيها العاب ( الكمبيوتر ,الموبايل , بلاي ستيشن )  والعاب مختلفة اخرى لو بتحب الالعاب بشكل عام ياريت تنورنى فى القناة :). ▬▬▬▬▬▬▬▬▬▬▬▬▬▬▬▬▬ للدعاية والاعلان .. For Business Inquiries: estubegaming@gmail.com "
Egypt,EG,15,216,UC1dGHGJTXU_dkiR8tW3qQgg,MPL Indonesia,7530000,3524949534,9522,Unknown,"THE ONE AND ONLY OFFICIAL YOUTUBE CHANNEL OF MPL INDONESIA.  Nantikan terus updates dan seru-seruan bareng di akun media sosial resmi MPL Indonesia. Jangan lupa difollow, ya!"
Egypt,EG,16,222,UCQHX6ViZmPsWiYSFAyS0a3Q,GothamChess,7300000,4792787804,3078,US,The Internet's Chess Teacher
Egypt,EG,17,239,UCV_CsAy5CNBX_uwDQ7RMe1Q,Central Cee,6700000,2440189843,92,GB,Central Cee - Official youtube channel. Subscribe
Egypt,EG,18,258,UC8H8YKUSFLtLxjt49tlyJwA,Abdo 2xd,6270000,2465297407,1827,EG,للأعلانات وللتواصل الإيميل الرسمي 📩 : abdo2xd.contact@gmail.com  في هذة القناة نقوم بعمل سيناريوهات لكرة القدم 🔥  في هذه القناة نقوم بتغطية أحداث كرة القدم العالمية والقارية بأفكار مختلفة وجذابة🔥 اشتركوا في القناة واستمتعوا معي في هذه الرحلة المجنونة❤️  بحبكم …. 💙 
Egypt,EG,19,271,UCUfAVz2qAODmBdq5rKB2Mvg,Abdo Mando - عبده ماندو,6000000,1898351610,2331,EG,والله هشترك .. علي فكرا انت حلفت  تحياتي معاكم عبده ماندو صاحب اقوي فيدوهات جيمنج قصيرة وكمان طويلة  كل الي طالبو منك يازميلي تعمل لايك ع الفيدوهات وتشترك في القناة الجميلة دي وتشغل زرار الجرس   للتواصل Instagram  abdo_mando_88   
Egypt,EG,20,281,UC4j8Thj3AUmH4PTM9YLAkSA,حسونة - Hassone,5720000,2044034427,1246,SA,For Ads and Business: hassone4business@gmail.com For Chinese Business: hassone@youdaoads.com Social Media: Insta: @hassone.yt TikTok: @hassone.ff Facebook: @hassone.gr 
Egypt,EG,21,311,UCGrquMHNrf8qU4jY89HHnuQ,Solom,5150000,2949936112,3489,SA,اهلا بيكم فى قناتى المتواضعة بنزل فيها لعبة roblox مغامرات وتحديات وسباقات لو كنت من عشاق لعبة روبلوكس اشترك فى القناة لمزيد من الفيديوهات الممتعة والجميلة !! ________________________________________________ للدعاية والاعلان .. For Business Inquiries: estubegaming@gmail.com 
Egypt,EG,22,320,UCRu9mro2nPafhMxVy2CRfXA,AboFlah Gaming,5050000,503138051,143,AE,قناتنا الخاصة للألعاب  بلعب العاب الي تنصحوني فيها 🔥      
Egypt,EG,23,321,UC_9GZ-5Wz5rjkWg4HAkWg_g,SPIDER GAMER,5040000,2202645015,1667,AE,شاب سوري قرر يبدأ بهاتف عادي ويخوض رحلة طويلة في اليوتيوب  الحمدلله وصلنا اكثر من مليونين متابع شكرااا لكم 8/12/2024 (06:18) ✔ للتواصل والاعلان : (( Spider@ar-ad.com )) MF-01-3294605
Egypt,EG,24,337,UCw4YUtV7FCTyOnVlsLbrWPA,Peekaa,4870000,1075206549,1050,JO,الحلم ممكن يصير حقيقية ❤️ بحبكم   For business: Peekaa.kay@gmail.com 
Egypt,EG,25,399,UClSBgGdaaWC76ebCT9kCumg,سامر المدني Samer Elmedany,4200000,538360769,91,EG,سوشيال ميديا : على فليكساوى Social Media👉  : Ali Flexawy  القناه الرسميه للفنان سامر المدني ❤️  اداره اعمال : محمد المدني
Egypt,EG,26,410,UCjHq0FqdRB0JP-1CcokW3-w,SA7RAWI,4080000,616530560,1635,SA,اني جيت 💚   للدعاية و الإعلان : sa777rawi@gmail.com  
Egypt,EG,27,426,UCUdxTqjcb4EYs07wSU6RJgQ,Dragunov YT,3910000,531219244,658,JO,واهلا فيكم مع دراغونوف From Zero to Hero !!  للاعلان على القناة: dragunov@ar-ad.com 
Egypt,EG,28,445,UCneq-pXhApziFpje2tIfofw,مـلـزلـز MLZLZ,3710000,753322498,1378,SA,◾️ For business inquiries 💬 Whatsapp : 00966590396388 ✉️ Email : info@mlzlz.net رخصة إعلانات : 190022
Egypt,EG,29,454,UCjcaajsmBVSmJUBJ92v39Jg,سوري جيمر - Syrian Gamer,3630000,1317955983,3520,GB,للإعلانات والتواصل 📩 Business enquires 📩 manarmadi000@gmail.com  Social Media +7M Followers 🌐 انا منار قناتي مخصصة للالعاب بدرجة كبيرة وغالباً فيفا مع بعض التنويع.. 🚀 Content creator @M7_EsportsTeam هدفي هو اني قدم محتوى ممتع ويخلي المشاهد يستمتع واوصل لأكبر عدد ممكن من الناس.. شكراً لكم على الدعم يااحلى ناس في الكون  للإعلانات - 📩  For Advertising :manarmadi000@gmail.com    
Egypt,EG,30,457,UC85aYbNSFjsJdxfpxgQr8tA,Judo Sloth Gaming,3600000,921882505,2047,GB,"A Clash of Clans based channel focusing on helping you improve your gameplay. You will see a variety of content from guides, to update sneak peeks and let's play videos. If you are a Clasher then Judo Sloth can help you with educational videos that are kept fun and entertaining. You will be able to stay up to date with all of the latest Clash of Clans Update News so be sure to subscribe. Have a go"
Egypt,EG,31,469,UC0JQyj6qRYY6Zvs_wLPwILw,Gaming3arbi العاب بالعربى,3440000,505542372,1447,Unknown,اهلا بيكم فى قناة جيمنج بالعربى اسمى احمد  القناة متخصصة بالالعاب وبتركيز اكبر على العاب الموبايل  هتلاقى عندنا العاب كتير زى ببجي موبايل وفرى فاير وابيكس ليجندز وبراول ستارز والعاب جديدة تجرب لاول مرة  هتلاقى فى القناة كل اللى ممكن تحتاجة علشان تحترف الالعاب دى وهتلاقى الاخبار الجديدة والتحديثات الموثقة والحصرية والصحيحة بنسبة 100% حلقتنا اصلية ومبتكرة والسلاسل عندنا كتيرة ومتنوعة ومابتنتهيش  اتف
Egypt,EG,32,470,UCiVJZlfcmWMUiXv5oywnDhQ,Wifies,3440000,313488621,541,US,I think it's pronounced wee-fees but I really have no idea  
Egypt,EG,33,478,UCnBLTjVEtEX4Ry7yqQaEYXg,Omar Kamal,3380000,1107828255,684,EG,Omar Kamal Official Youtube Channel أهلا وسهلا بكم فى القناة الرسمية للفنان عمر كمال أشترك معنا فى القناة ليصلك كل الجديد والحصرى قبل أى حد أغانى سنجل - كليبات - حفالات - أفراح - برامج تلفزيونية حصريا هنا فقط https://www.youtube.com/OmarKamal https://www.youtube.com/OmarKamalLive ▬▬▬▬▬ஜ۩۞۩ஜ▬▬▬▬▬ الحساب الرسمى على الفيس بوك www.facebook.com/OmarKamalok ▬▬▬▬▬ஜ۩۞۩ஜ▬▬▬▬▬ الحساب الرسمى على تويتر https:
Egypt,EG,34,487,UCcPzc4OgQhOafu5DHDkxg0A,Zzz Red FF☠️,3330000,1492496951,3185,US,"🔥 Zzz Red FF ek thrilling gaming challenge hai jo Free Fire aur PC training games ke shaukeen players ke liye hai! Yahaan pro-level skills, intense battles aur tactical gameplay dekhne ko milta hai.  ✅ Epic challenges aur high-intensity matches ✅ Gaming tricks, strategies aur clutch moments ✅ Pro players aur beginners ke liye ek engaging community  Agar aapko next-level gaming aur exciting challen"
Egypt,EG,35,522,UCoZ-SR865yc4IvvVVqkixpQ,Rahumi - رحومي,3080000,838731154,702,AE,تجمعنا لحظات ماين كرافت وروبلوكس. تعالوا نمرح ونلعب سوية! اضغطوا اشتراك وخل نتونس أكثر! 🎮🕺🏻💥 
Egypt,EG,36,528,UCfUpd-YBRgX_nZbBvlx6e6A,سلطان الشن - Sultan Elshan,3060000,1455163320,245,EG,القناة الرسمية لسلطان الشن ـــــــــــــــــــــــــــــــــــــــــــــــــــــــــــــــــ القناة الرسمية للمنتج السعودي سلطان الشن 🇸🇦🫡♥️  ـــــــــــــــــــــــــــــــــــــــــــــــــــــــــــــــــ لا تنسوا الاشتراك بالقناة وتفعيل زر الجرس ليصلكم كل جديد للتواصل  acefawzi@protonmail.com واتساب 00966535004005
Egypt,EG,37,530,UCkAMm0hAJ67ynwZxtxez32Q,Aly & Toty Gaming,3060000,956259823,1328,EG,احنا عيلة بسيطة وعندنا حلم كبير بنحب نلعب روبلوكس بس قررنا ان احنا نلعب ونعمل قصص مفيده ومضحكة فى نفس الوقت اشترك فى القناة لمزيد من الفيديوهات الممتعة والجميلة
Egypt,EG,38,549,UCAOTKL12DgJjxTmzoVSaSBQ,AB GAMING - اي بي جيمينج,2940000,256570968,3505,EG,For advertisement : bussabvideo@gmail.com  نورتني في قناتي المتواضعة اتمني اكون سبب في سعادتك. اذكر الله ... سبحان الله و بحمدهـ سبحان الله العظيم ♥ (لا إله إلا الله سبحانك إني كنت من ظالمين)
Egypt,EG,39,600,UChPRO1CB_Hvd0TvKRU62iSQ,Harry Potter,2660000,1675050859,2667,US,"Welcome to the official Harry Potter YouTube channel, home to 25 years of magic.  Subscribe to receive official news and updates first by becoming a member of the Harry Potter Fan Club, and enjoy the magic all year round: https://www.harrypotter.com/harry-potter-fan-club  Relive every moment of magic and take home the Harry Potter Complete Collection: https://www.warnerbros.com/movies/harry-potter"
Egypt,EG,40,663,UCV5ZVvsnqXniOnI4yydz8pQ,لانا و رورو,2360000,911501375,452,Unknown,اهلاً اهلاً في قناتنا 😍👈🏻: . نحب متابعيننا أكثر شي في الحياة 🥹♥️ . (لانا و رورور ) vtuber صانعين محتوى ألعاب 🎮✨ في قناتنا نلعب مابات روبلوكس ◻️ وألعاب اخرى متنوعة 😃 نقدم لكم كل جديد في عالم القيمنق بطريقة مميزة وممتعة😉👌🏻   🚨هذه قناتنا الوحيدة التي نقدم فيها محتوى روبولكس أي قناة اخرى تستخدم صورنا وشخصياتنا او تقلد اسلوبنا فهم منتحلين لنا وغير مسؤولين عنهم  🚨أسم قناة لانا 👈🏻 lana toca boca   لانا ت
Egypt,EG,41,665,UCVxwBTge581US4PYswNDivg,Ahmed Aslan,2340000,870219382,2448,EG,احمد اصلان يرحب بالسادة الأعضاء
Egypt,EG,42,686,UCsEg-DLDX3TeMDDf0hOTtEQ,Ismailinho اسماعيلينو,2240000,449361719,809,SA,للتواصل والإعلانات : ismailinho007hs@gmail.com
Egypt,EG,43,724,UCkPjGQlqzXbDD7R-KDZxkUg,Buggy Huggy,2090000,1008917019,1047,US,"Hi! My name is Vlad and here i will post some videos from Poppy Playtime game. You will see game mods, edits and glitches with Huggy Wuggy, Kissy Missy and Poppy."
Egypt,EG,44,739,UCihg-Aew0pQYKiAOLnPA8GA,أحمد - Nemesis,2050000,493235015,1188,SA,السلام عليكم، حياكم الله في قناتي اللي اقدم فيها محتوى العاب الكترونية ترفيهي. اتمنى لكم مشاهدة ممتعة.  للدعاية والإعلان التواصل على الايميل: Ah.A.Nemesis@Gmail.com For ads please reach me via my email: Ah.A.Nemesis@Gmail.com 
Egypt,EG,45,794,UCFHyDOBjQqL-3HToE9Yw3RA,3li Boltx,1840000,436127687,733,EG,The Egyptian Gaming Icon  🏆  Subscribe For A Dopamine Spike ⚡️
Egypt,EG,46,829,UC2qdrMpLKn3GgeCwN65SX_Q,SA7RAWI Gaming,1730000,259044291,593,SA,2521  للدعاية و الإعلان For Business : 🔰 sa777rawi@gmail.com 
Egypt,EG,47,885,UCK3gKjp6GA9vaR372gFUd4Q,Aslano,1580000,855499018,1456,EG,قناة اصلانو 
Egypt,EG,48,913,UCOYBtBZtz0xVraIhB_rhEnw,Mkamel,1500000,327887141,757,EG,احم احم احم انا محمود كامل المهنه بحب افرح اي حد مهما كان سنه  للتواصل والاعلانات : mkamelbusiness1@gmail.com ❤🔥  اسمي في ببجي : Mkamelg  متنساش بقي دعمك ليا بلايك واشتراك :)  سُبْحَانَ اللهِ وَالحَمْدُ للهِ وَلا إِلَهَ إِلا الله وَالله أَكْبَرُ وَلا حَوْلَ وَلا قُوَّةَ إِلا بِاللهِ
Egypt,EG,49,931,UCwTidudFh8wlgSk1gsMys2Q,Migo9,1460000,696623669,1930,AE,اتمنى اقدم حاجه تعجبكم 😍😘 بحبكم 💛 #احنا_الجامدين
Egypt,EG,50,1014,UC0S9MJJGkl-d96KKgNnIa1g,BEPO FF,1280000,142272697,276,EG,اخوكو بيبو صانع البهجة والمتعة مش صانع محتوى😉🔥 للتواصل والاعلان 👇🏽 business inquiries  bepoff196@gmail.com  _______________________________________  تابعوني علي انستجرام 👇🏽  https://www.instagram.com/bepo_ff/   تابعوني على تطبيق الكيك 👇🏽  https://kick.com/bepotv _______________________________________  تابعوني علي تيك توك 👇🏽   https://www.tiktok.com/@bepoff?is_from_webapp=1&sender_device=pc  _____
Egypt,EG,51,1104,UC5E-AzEYfm_Neegg3siRchg,SoSy,1100000,883724575,772,EG,تعالوا ناكل دوناتس سوا 🍩🤍
Egypt,EG,52,1110,UC1C2VTdEHmQD-3GINYSHuFA,Abdullah Reviews,1100000,349778817,1022,SA,اشترك بالقناة واستمتع ❤️ 
Egypt,EG,53,1111,UCJTg_5osszRiVFiR4GPnMZw,Gaming3arbi Live,1100000,181890857,903,Unknown,  اهلا بيكم فى قناة جيمنج بالعربى اسمى احمد  القناة متخصصة بالالعاب وبتركيز اكبر على العاب الموبايل  هتلاقى عندنا العاب كتير زى ببجي موبايل وفرى فاير وابيكس ليجندز وبراول ستارز والعاب جديدة تجرب لاول مرة  هتلاقى فى القناة كل اللى ممكن تحتاجة علشان تحترف الالعاب دى وهتلاقى الاخبار الجديدة والتحديثات الموثقة والحصرية والصحيحة بنسبة 100% حلقتنا اصلية ومبتكرة والسلاسل عندنا كتيرة ومتنوعة ومابتنتهيش  ا
Egypt,EG,54,1125,UCu7ODDeIZ4x1rJwM1LCVL8w,Thebausffs,1070000,627744806,1136,SE,Hey guys it's me Thebausffs EUW challenger OTP full AD Sion. You can find me everyday on my twitch channel http://www.twitch.tv/thebausffs Twitter : twitter.com/thebausffs Discord : discord.gg/thebausffs
Egypt,EG,55,1169,UCQOFdQYNnIzuvVz29uiL-xA,Doctor Misho,1010000,367993554,1524,EG,بداية حلم المليون .. 
Egypt,EG,56,1176,UCjA5UUapHfA7liNa-rI2nrQ,كريم كرستيانو - karim Cristiano,1000000,327969169,73,Unknown,
Egypt,EG,57,1224,UCXWfmXteFx5KLLBnxV0fq7A,AuzioMF,938000,790957634,4498,GB,EAFC Content Creator 😎  Thanks for the support ❤️
Egypt,EG,58,1227,UCAlsEIlAg9i2JhAlYtdGvEA,احمد - ستورم,934000,301893700,2052,EG,إشترك في القناة عشان تنضم الي عائلتي 🌸سبحان الله وبحمده سبحان الله العظيم🌸 ❤ليس جميع الجايميرز أغنياء❤ ✨ليس جميع اليوتوبرز أغنياء✨ هناك منهم من إختار طريق اليوتيوب لأحلام يريد تحقيقها أو لضغوطات و مشاكل شخصية يريد نسيانها  فلا تنسى أن كلمة جميلة منك تمثل حافز كبيرا  له فلا تكون خبيثا في كلامك و لا تبخل عن تشجيع كل من يستحق صوتك ! 💔 للاعلانات التجارية والشخصيه mohamedmozy1@gmail.com   
Egypt,EG,59,1261,UC2qu-0lmhiAStsA83u-Ol-Q,Mohamed Adel  TV,877000,204516091,1613,EG,للأعلانات وللتواصل الإيميل الرسمي 📩 : snrmaster444@gmail.com  بنلعب FC Mobile وبنعمل تحديات ناار 🔥 ان شاء الله رحلتنا هتكون للمليون والاكتر من المليون واستمتع بالرحلة معايا ❤️ اتمنى انك تكون جزء من العيلة للمليون وتشترك معانام في القناة❤️  قلب اخووك ❤️ 
Egypt,EG,60,1299,UCayyBWtI1PxJCtieqKUQZnA,اصحاب مازن,836000,144263208,268,SA, اهلا بالجميع انا مازن اقدم محتوى للترفيه    | سبحان الله وبحمده سبحان الله العظيم ✨ | اللهم صل وسلم وبارك على نبينا محمد✨   حسابي في روبلوكس : robocububu   حسابي في التيكتوك : robocu1                                        💜❤️💛💙🩷🧡 
Egypt,EG,61,1304,UCqZJbp4SkbuZhZTwlX9NMTg,SOKAR YT,832000,96638447,2370,MA,الحمد لله رب العالمين 🤲 من تواضع لله رفعه 💚
Egypt,EG,62,1322,UCLKk-PWbcOTB3qyMWsfs8ag,MessiGaming10,818000,140856971,1272,EG,صل على سيدنا محمد (صلي الله عليه وسلم) 🤍👑  انا محمد عبد الفتاح من مصر   بنزل علي القناة محتوي بيس موبايل من ( تسريبات للاحداث _ جوائز شحن كوينز المتابعين باستمرار _ تفتيح بكجات _ ثغرات البكجات _ شرحات للعبة ) باختصار جميع الأشياء المتعلقة بالعبة سوف تجدها هنا في هذة القناة أن شاء الله فاتمني ان تنال القناة اعجابكم 💙  اشترك في القناه ياخويا علشان مش يفوتك اي شئ 💜 
Egypt,EG,63,1324,UCQUCvL7FnDN5ZxzN3U_L1xw,KROLO FF,815000,70532307,2383,DZ,"الحمد لله كثيرا ❤️ سأصل 1m بإذن الله 💪  للإعلان و الدعاية 👇👇  حسابي على الأنستغرام : KROLO FF   مرحبا بك يا أسطورة في عائلة كرولو 🩵 - تقدم هذه القناة محتوى تسريبات للعبة فري فاير و أيضا شرح أحداث , حرق , و كل ما يخص لعبة فري فاير   ولما تنتسب في القناة راح تحصل على إمتيازات حصرية  🌌✨☄️🌠💫  أهداف القناة 🎯    10000✅️ 100000✅️ 300000✅️ 500000✅️ 700000 ✅️ 800000 ⌛️  هدفنا نوصل إلى مليون مشترك بإذن الله"
Egypt,EG,64,1349,UC9de4K00-WJx6pL90iDkOTw,HikaSIU,787000,84279242,173,EG,قناة هيكا بعد إعتزالة الملاعب
Egypt,EG,65,1415,UC8zRRJw0nnVrODYn6JnUHVw,ABUAL3OS / أبو العص,721000,124385144,767,SA,اهلين أنا أبو العص  صانع المحتوى بالصدفه 😅…
Egypt,EG,66,1422,UCYUNGTgRf6tB82JiPaouRag,MASTER OF GAMES,715000,149250533,2964,TR,اخواني الي بحبهم وبفتخر فيهم 💚🙏🏻. 
Egypt,EG,67,1446,UChxL5BBwSFY2wX8OfX_-8UQ,نينجا جيمنج NINJA Gaming l,687000,102816038,696,EG,N I N J A 
Egypt,EG,68,1478,UCe7_rXDglhK-UCbCQnpIf6A,تيتو بندق ,658000,197785148,252,EG,القناة الرسمية للفنان تيتو بندق 🎤..  هنا بيت الفن والموهبة الحقيقية من قلب الإسكندرية للعالم ✨🌊. اشتركوا وفعلوا الجرس لمتابعة كل جديد وحصري 🔔🔥. ​The Official Channel of Tito Bondok 🎤.  Home of authentic talent and premium production from Alexandria to the world ✨🌊. Subscribe for exclusive releases 🔔🔥. ​🎼 الكتالوج الموسيقي: استرجاع لأجمل الألحان والكلمات التي كانت وما زالت جزءاً من وجدان الجمهور من
Egypt,EG,69,1531,UC8gfuntXFc6fzYLx6Zi5B8Q,من بره التمنتاشر,620000,51061270,291,US,اهلا بيك يا لعيب ♥️ .   هتلاقي هنا .. احداث يوم الاتنين واحداث يوم الخميس  بكجات ايام الاتنين والخميس  بكجات نجوم الاسبوع تفتيح بكجات اسطوري تطوير اللاعبيين  شرح خطط وتكتيكات  نصايح مهمة للعبة لاعبيين اندريتد اخر اخبار العبة والاحداث هنتعلم مع بعض ازاي تحترف efootball وتكسب اي خصم يواجهك  طرق الدفاع في efootball طرق الهجوم في efootball احسن المدربين لخطتك ازاي تكون فريق الاحلام ازاي تكون تشكيلة اس
Egypt,EG,70,1532,UClZ6iiejnLTZlzrSzNsqx1Q,KhaliDasEC0,619000,108081524,511,AE,ولله تعب شديد يا
Egypt,EG,71,1534,UC8nhabvwh2r97Rt4aXYQ5gw,OMAR BOYKA - عمر بويكا,616000,128738310,827,SA,✨مساء السعادة بكميات زيادة✨❤️ .. اهلا بيك في عائلة ملوك السعادة❤️ ملوك السعادة🔥🔥💪 متنساش تصلي على النبي ﷺ❤️❤️ هكونا ماتاتا✌️🌴❤️
Egypt,EG,72,1537,UCRohyBgTdaunp3_roTNDUYg,HikaGamingExtra,613000,191836190,320,EG,إنت عامل إية؟
Egypt,EG,73,1556,UCY5Zs3Y76ILKOdJODtlsiBw,RTQ,601000,101651301,224,Unknown, أيميل الأعلانات : rtqtbb@gmail.com
Egypt,EG,74,1614,UCVGvyqygtH9y4frLIrAoxMQ,Mahmoud GRX,559000,72993127,3074,US,هدفنا نوصل 600 الف اخ واخت ❤️ دخلت هنا لاتحرمني من دعمك بأشتراك ولايك   ‏لكي تنجح يجب أن تكون رغبتك في النجاح أكبر من خوفك من الفشل.🍁❄️  يارب يتحقق حلمي ❤️ (‏سأبقى على يقين بأن ما أحلم به ، سيأتي يوماً) 💕 ‏كُن قوياً وتذكر ، لا يُهزم مَن آمن باللّه ♥️
Egypt,EG,75,1651,UCkSMaBSd4vOTFq3nYU4HvDQ,LUF / لوف,531000,153571018,630,JO,للتواصل والاعلانات info.l7luf@gmail.com   صلو على سيدنا محمد عليه الصلاة والسلام  
Egypt,EG,76,1652,UC5tmp5TQQpI1WicemM2t_IA,ماهر المغامر - Maher Roblox,530000,102369610,159,JO,للإعلان على القناة : maher.ryt.ads@gmail.com  
